{
  "receipt_id": "agent-exec-72f7ac26-e28b-47b1-84c1-d1bd3cc61c91",
  "created_at": "2026-01-28T15:27:04.275045+00:00",
  "run_id": "9b568dff-bb31-4881-b91d-faa2ce430f3c",
  "graph_id": "graph-0001",
  "agent_profile_id": "kernel-default",
  "status": "INSTALLED",
  "run_state_path": "//Users/macbook/Desktop/a2rchitech-workspace/a2rchitech/.a2r/run_state/9b568dff-bb31-4881-b91d-faa2ce430f3c.json",
  "receipts_dir": "//Users/macbook/Desktop/a2rchitech-workspace/a2rchitech/.a2r/receipts/9b568dff-bb31-4881-b91d-faa2ce430f3c",
  "artifacts_dir": "//Users/macbook/Desktop/a2rchitech-workspace/a2rchitech/.a2r/artifacts/9b568dff-bb31-4881-b91d-faa2ce430f3c",
  "node_receipts": [],
  "tool_receipts": [],
  "subprocess_receipts": []
}