{
  "receipt_id": "agent-exec-29ad34a5-d907-484a-abdf-aef677174e05",
  "created_at": "2026-01-28T15:27:06.766981+00:00",
  "run_id": "42fd7afe-7038-49ce-8787-e80ed50fa0aa",
  "graph_id": "graph-0001",
  "agent_profile_id": "kernel-default",
  "status": "RESUMED",
  "run_state_path": "//Users/macbook/Desktop/a2rchitech-workspace/a2rchitech/.a2r/run_state/42fd7afe-7038-49ce-8787-e80ed50fa0aa.json",
  "receipts_dir": "//Users/macbook/Desktop/a2rchitech-workspace/a2rchitech/.a2r/receipts/42fd7afe-7038-49ce-8787-e80ed50fa0aa",
  "artifacts_dir": "//Users/macbook/Desktop/a2rchitech-workspace/a2rchitech/.a2r/artifacts/42fd7afe-7038-49ce-8787-e80ed50fa0aa",
  "node_receipts": [],
  "tool_receipts": [],
  "subprocess_receipts": []
}