{
  "receipt_id": "agent-exec-e2b58d0b-2528-401f-9398-9680f8cb5226",
  "created_at": "2026-01-28T15:36:59.560359+00:00",
  "run_id": "0245c52d-9f38-40c0-b035-05a701f3a29e",
  "graph_id": "graph-0001",
  "agent_profile_id": "kernel-default",
  "status": "RESUMED",
  "run_state_path": "//Users/macbook/Desktop/a2rchitech-workspace/a2rchitech/.a2r/run_state/0245c52d-9f38-40c0-b035-05a701f3a29e.json",
  "receipts_dir": "//Users/macbook/Desktop/a2rchitech-workspace/a2rchitech/.a2r/receipts/0245c52d-9f38-40c0-b035-05a701f3a29e",
  "artifacts_dir": "//Users/macbook/Desktop/a2rchitech-workspace/a2rchitech/.a2r/artifacts/0245c52d-9f38-40c0-b035-05a701f3a29e",
  "node_receipts": [],
  "tool_receipts": [],
  "subprocess_receipts": []
}