{
  "receipt_id": "agent-exec-0001",
  "created_at": "2026-01-28T00:00:00Z",
  "run_id": "run-123",
  "graph_id": "graph-0001",
  "agent_profile_id": "kernel-default",
  "status": "RUNNING",
  "run_state_path": "/.a2r/run_state/run-123.json",
  "receipts_dir": "/.a2r/receipts/run-123",
  "artifacts_dir": "/.a2r/artifacts/run-123",
  "node_receipts": [],
  "tool_receipts": [],
  "subprocess_receipts": []
}
