{
  "receipt_id": "agent-exec-7c87d47b-3f05-445e-98a6-d9db3357f3f2",
  "created_at": "2026-01-28T09:09:00.239186+00:00",
  "run_id": "bd8bc80e-ab59-4536-91db-e25af86599a4",
  "graph_id": "graph-0001",
  "agent_profile_id": "kernel-default",
  "status": "RESUMED",
  "run_state_path": "//Users/macbook/Desktop/a2rchitech-workspace/a2rchitech/.a2r/run_state/bd8bc80e-ab59-4536-91db-e25af86599a4.json",
  "receipts_dir": "//Users/macbook/Desktop/a2rchitech-workspace/a2rchitech/.a2r/receipts/bd8bc80e-ab59-4536-91db-e25af86599a4",
  "artifacts_dir": "//Users/macbook/Desktop/a2rchitech-workspace/a2rchitech/.a2r/artifacts/bd8bc80e-ab59-4536-91db-e25af86599a4",
  "node_receipts": [],
  "tool_receipts": [],
  "subprocess_receipts": []
}