{
  "receipt_id": "agent-exec-1e869126-368f-47c8-9616-e9e17a281af8",
  "created_at": "2026-01-28T16:49:02.473196+00:00",
  "run_id": "5b99aa2d-45b5-4131-a10b-02d801332369",
  "graph_id": "graph-0001",
  "agent_profile_id": "kernel-default",
  "status": "INSTALLED",
  "run_state_path": "//Users/macbook/Desktop/a2rchitech-workspace/a2rchitech/.a2r/run_state/5b99aa2d-45b5-4131-a10b-02d801332369.json",
  "receipts_dir": "//Users/macbook/Desktop/a2rchitech-workspace/a2rchitech/.a2r/receipts/5b99aa2d-45b5-4131-a10b-02d801332369",
  "artifacts_dir": "//Users/macbook/Desktop/a2rchitech-workspace/a2rchitech/.a2r/artifacts/5b99aa2d-45b5-4131-a10b-02d801332369",
  "node_receipts": [],
  "tool_receipts": [],
  "subprocess_receipts": []
}