{
  "receipt_id": "agent-exec-a7afa255-0182-4fee-b392-0789d1723747",
  "created_at": "2026-01-28T09:05:22.160074+00:00",
  "run_id": "157f6ed4-127e-4984-9549-179ee536ba89",
  "graph_id": "graph-0001",
  "agent_profile_id": "kernel-default",
  "status": "RESUMED",
  "run_state_path": "//Users/macbook/Desktop/a2rchitech-workspace/a2rchitech/.a2r/run_state/157f6ed4-127e-4984-9549-179ee536ba89.json",
  "receipts_dir": "//Users/macbook/Desktop/a2rchitech-workspace/a2rchitech/.a2r/receipts/157f6ed4-127e-4984-9549-179ee536ba89",
  "artifacts_dir": "//Users/macbook/Desktop/a2rchitech-workspace/a2rchitech/.a2r/artifacts/157f6ed4-127e-4984-9549-179ee536ba89",
  "node_receipts": [],
  "tool_receipts": [],
  "subprocess_receipts": []
}