{
  "receipt_id": "agent-exec-4dddd1cb-04d2-4cbe-a4dd-e16fce5db9ed",
  "created_at": "2026-01-28T15:35:08.213386+00:00",
  "run_id": "18e92a68-4cd4-4f34-a964-5269ffa866dd",
  "graph_id": "graph-0001",
  "agent_profile_id": "kernel-default",
  "status": "RESUMED",
  "run_state_path": "//Users/macbook/Desktop/a2rchitech-workspace/a2rchitech/.a2r/run_state/18e92a68-4cd4-4f34-a964-5269ffa866dd.json",
  "receipts_dir": "//Users/macbook/Desktop/a2rchitech-workspace/a2rchitech/.a2r/receipts/18e92a68-4cd4-4f34-a964-5269ffa866dd",
  "artifacts_dir": "//Users/macbook/Desktop/a2rchitech-workspace/a2rchitech/.a2r/artifacts/18e92a68-4cd4-4f34-a964-5269ffa866dd",
  "node_receipts": [],
  "tool_receipts": [],
  "subprocess_receipts": []
}