{
  "receipt_id": "agent-exec-95a21599-7c63-4edd-a0d1-2c3bada94e09",
  "created_at": "2026-01-28T16:02:38.176939+00:00",
  "run_id": "ffa013bb-60f8-4190-a049-f4012b1e1bb9",
  "graph_id": "graph-0001",
  "agent_profile_id": "kernel-default",
  "status": "INSTALLED",
  "run_state_path": "//Users/macbook/Desktop/a2rchitech-workspace/a2rchitech/.a2r/run_state/ffa013bb-60f8-4190-a049-f4012b1e1bb9.json",
  "receipts_dir": "//Users/macbook/Desktop/a2rchitech-workspace/a2rchitech/.a2r/receipts/ffa013bb-60f8-4190-a049-f4012b1e1bb9",
  "artifacts_dir": "//Users/macbook/Desktop/a2rchitech-workspace/a2rchitech/.a2r/artifacts/ffa013bb-60f8-4190-a049-f4012b1e1bb9",
  "node_receipts": [],
  "tool_receipts": [],
  "subprocess_receipts": []
}