{
  "receipt_id": "agent-exec-d19cfb6c-e82a-4879-9350-41302bcae06c",
  "created_at": "2026-01-28T15:35:08.054043+00:00",
  "run_id": "cb28d470-e188-4cfc-968b-14253e6ef2d4",
  "graph_id": "graph-0001",
  "agent_profile_id": "kernel-default",
  "status": "INSTALLED",
  "run_state_path": "//Users/macbook/Desktop/a2rchitech-workspace/a2rchitech/.a2r/run_state/cb28d470-e188-4cfc-968b-14253e6ef2d4.json",
  "receipts_dir": "//Users/macbook/Desktop/a2rchitech-workspace/a2rchitech/.a2r/receipts/cb28d470-e188-4cfc-968b-14253e6ef2d4",
  "artifacts_dir": "//Users/macbook/Desktop/a2rchitech-workspace/a2rchitech/.a2r/artifacts/cb28d470-e188-4cfc-968b-14253e6ef2d4",
  "node_receipts": [],
  "tool_receipts": [],
  "subprocess_receipts": []
}