{
  "receipt_id": "agent-exec-414cc7a2-a859-49ea-99ab-de028e984e0d",
  "created_at": "2026-01-28T15:36:59.423125+00:00",
  "run_id": "296324d8-90e6-4c86-a165-6834c9f45cba",
  "graph_id": "graph-0001",
  "agent_profile_id": "kernel-default",
  "status": "RESUMED",
  "run_state_path": "//Users/macbook/Desktop/a2rchitech-workspace/a2rchitech/.a2r/run_state/296324d8-90e6-4c86-a165-6834c9f45cba.json",
  "receipts_dir": "//Users/macbook/Desktop/a2rchitech-workspace/a2rchitech/.a2r/receipts/296324d8-90e6-4c86-a165-6834c9f45cba",
  "artifacts_dir": "//Users/macbook/Desktop/a2rchitech-workspace/a2rchitech/.a2r/artifacts/296324d8-90e6-4c86-a165-6834c9f45cba",
  "node_receipts": [],
  "tool_receipts": [],
  "subprocess_receipts": []
}