{
  "receipt_id": "agent-exec-4864561f-9ccf-480c-84cc-d60eaa84fac3",
  "created_at": "2026-01-28T16:49:02.336443+00:00",
  "run_id": "713eef86-3d18-4ce4-b91c-d8fcc19dcb34",
  "graph_id": "graph-0001",
  "agent_profile_id": "kernel-default",
  "status": "INSTALLED",
  "run_state_path": "//Users/macbook/Desktop/a2rchitech-workspace/a2rchitech/.a2r/run_state/713eef86-3d18-4ce4-b91c-d8fcc19dcb34.json",
  "receipts_dir": "//Users/macbook/Desktop/a2rchitech-workspace/a2rchitech/.a2r/receipts/713eef86-3d18-4ce4-b91c-d8fcc19dcb34",
  "artifacts_dir": "//Users/macbook/Desktop/a2rchitech-workspace/a2rchitech/.a2r/artifacts/713eef86-3d18-4ce4-b91c-d8fcc19dcb34",
  "node_receipts": [],
  "tool_receipts": [],
  "subprocess_receipts": []
}