{
  "receipt_id": "agent-exec-0f8cf3d5-a081-45b0-b4df-1e979820f5cd",
  "created_at": "2026-01-28T15:35:10.804368+00:00",
  "run_id": "553d2aa4-8da0-41b8-8813-eaeee56736fe",
  "graph_id": "graph-0001",
  "agent_profile_id": "kernel-default",
  "status": "RESUMED",
  "run_state_path": "//Users/macbook/Desktop/a2rchitech-workspace/a2rchitech/.a2r/run_state/553d2aa4-8da0-41b8-8813-eaeee56736fe.json",
  "receipts_dir": "//Users/macbook/Desktop/a2rchitech-workspace/a2rchitech/.a2r/receipts/553d2aa4-8da0-41b8-8813-eaeee56736fe",
  "artifacts_dir": "//Users/macbook/Desktop/a2rchitech-workspace/a2rchitech/.a2r/artifacts/553d2aa4-8da0-41b8-8813-eaeee56736fe",
  "node_receipts": [],
  "tool_receipts": [],
  "subprocess_receipts": []
}