{
  "receipt_id": "agent-exec-72519e22-ce1e-4801-a8a3-7ecf7c952770",
  "created_at": "2026-01-28T16:49:02.534661+00:00",
  "run_id": "5b99aa2d-45b5-4131-a10b-02d801332369",
  "graph_id": "graph-0001",
  "agent_profile_id": "kernel-default",
  "status": "RESUMED",
  "run_state_path": "//Users/macbook/Desktop/a2rchitech-workspace/a2rchitech/.a2r/run_state/5b99aa2d-45b5-4131-a10b-02d801332369.json",
  "receipts_dir": "//Users/macbook/Desktop/a2rchitech-workspace/a2rchitech/.a2r/receipts/5b99aa2d-45b5-4131-a10b-02d801332369",
  "artifacts_dir": "//Users/macbook/Desktop/a2rchitech-workspace/a2rchitech/.a2r/artifacts/5b99aa2d-45b5-4131-a10b-02d801332369",
  "node_receipts": [],
  "tool_receipts": [],
  "subprocess_receipts": []
}