{
  "receipt_id": "agent-exec-36c8aedd-3434-440d-88e0-1ec3c9f8b1ff",
  "created_at": "2026-01-28T16:02:38.526199+00:00",
  "run_id": "36b264de-eb0c-4cff-b4bb-ce0f3cd94e32",
  "graph_id": "graph-0001",
  "agent_profile_id": "kernel-default",
  "status": "RESUMED",
  "run_state_path": "//Users/macbook/Desktop/a2rchitech-workspace/a2rchitech/.a2r/run_state/36b264de-eb0c-4cff-b4bb-ce0f3cd94e32.json",
  "receipts_dir": "//Users/macbook/Desktop/a2rchitech-workspace/a2rchitech/.a2r/receipts/36b264de-eb0c-4cff-b4bb-ce0f3cd94e32",
  "artifacts_dir": "//Users/macbook/Desktop/a2rchitech-workspace/a2rchitech/.a2r/artifacts/36b264de-eb0c-4cff-b4bb-ce0f3cd94e32",
  "node_receipts": [],
  "tool_receipts": [],
  "subprocess_receipts": []
}