{
  "receipt_id": "agent-exec-929b41f9-5afc-4b13-b938-df74808a1cc1",
  "created_at": "2026-01-28T16:02:38.275940+00:00",
  "run_id": "fe0fcaf3-c03c-472e-9f1d-3a9034953d47",
  "graph_id": "graph-0001",
  "agent_profile_id": "kernel-default",
  "status": "INSTALLED",
  "run_state_path": "//Users/macbook/Desktop/a2rchitech-workspace/a2rchitech/.a2r/run_state/fe0fcaf3-c03c-472e-9f1d-3a9034953d47.json",
  "receipts_dir": "//Users/macbook/Desktop/a2rchitech-workspace/a2rchitech/.a2r/receipts/fe0fcaf3-c03c-472e-9f1d-3a9034953d47",
  "artifacts_dir": "//Users/macbook/Desktop/a2rchitech-workspace/a2rchitech/.a2r/artifacts/fe0fcaf3-c03c-472e-9f1d-3a9034953d47",
  "node_receipts": [],
  "tool_receipts": [],
  "subprocess_receipts": []
}